{
    "count": 1,
    "next": null,
    "previous": null,
    "results": [
        {
            "id": 36240,
            "game_id": 2033,
            "game_slug": "world-of-warcraft",
            "name": "World of Warcraft",
            "year": 2004,
            "user": "DeadKper",
            "runner": "wine",
            "slug": "world-of-warcraft-standard",
            "version": "Standard",
            "description": "",
            "notes": "",
            "credits": "",
            "created_at": "2022-11-18T17:51:03.085000Z",
            "updated_at": "2023-12-01T22:50:20.249076Z",
            "draft": false,
            "published": true,
            "published_by": 1,
            "rating": "",
            "is_playable": null,
            "steamid": null,
            "gogid": null,
            "gogslug": "",
            "humbleid": "",
            "humblestoreid": "",
            "humblestoreid_real": "",
            "script": {
                "files": [
                    {
                        "setup": {
                            "filename": "Battle.net-Setup.exe",
                            "url": "https://www.battle.net/download/getInstallerForGame?os=win&gameProgram=BATTLENET_APP&version=Live"
                        }
                    }
                ],
                "game": {
                    "arch": "win64",
                    "args": "--exec=\"launch WoW\" --exec=\"focus play\"",
                    "exe": "drive_c/Program Files (x86)/Battle.net/Battle.net.exe",
                    "prefix": "$GAMEDIR"
                },
                "installer": [
                    {
                        "task": {
                            "arch": "win64",
                            "description": "Creating 64bit Wine prefix.",
                            "name": "create_prefix",
                            "prefix": "$GAMEDIR"
                        }
                    },
                    {
                        "task": {
                            "app": "arial",
                            "arch": "win64",
                            "description": "Installing Arial font...",
                            "name": "winetricks",
                            "prefix": "$GAMEDIR",
                            "silent": true
                        }
                    },
                    {
                        "task": {
                            "name": "winekill",
                            "prefix": "$GAMEDIR"
                        }
                    },
                    {
                        "write_json": {
                            "data": {
                                "Client": {
                                    "GameLaunchWindowBehavior": "2",
                                    "GameSearch": {
                                        "BackgroundSearch": "true"
                                    },
                                    "HardwareAcceleration": "false",
                                    "Sound": {
                                        "Enabled": "false"
                                    },
                                    "Streaming": {
                                        "StreamingEnabled": "false"
                                    }
                                }
                            },
                            "description": "Writing a Battle.Net config file",
                            "file": "$GAMEDIR/drive_c/users/$USER/Application Data/Battle.net/Battle.net.config"
                        }
                    },
                    {
                        "task": {
                            "arch": "win64",
                            "description": "Wine Staging: Enabling DXVA2",
                            "key": "backend",
                            "name": "set_regedit",
                            "path": "HKEY_CURRENT_USER\\Software\\Wine\\DXVA2",
                            "prefix": "$GAMEDIR",
                            "value": "va"
                        }
                    },
                    {
                        "task": {
                            "name": "winekill",
                            "prefix": "$GAMEDIR"
                        }
                    },
                    {
                        "task": {
                            "arch": "win64",
                            "description": "Installing Blizzard App. An installer will open.\n------------------------------\nAfter the App installs a login window will open.  Do Not sign in here. Close the window and allow the installer to finish.  You can login and install the game once the installer script completes.",
                            "exclude_processes": "Battle.net.exe Agent.exe \"Battle.net Helper.exe\" wineconsole explorer.exe conhost.exe svchost.exe",
                            "executable": "setup",
                            "name": "wineexec"
                        }
                    },
                    {
                        "task": {
                            "name": "winekill",
                            "prefix": "$GAMEDIR"
                        }
                    }
                ],
                "system": {
                    "env": {
                        "DXVK_CONFIG_FILE": "$GAMEDIR/dxvk.conf",
                        "DXVK_HUD": "compiler",
                        "DXVK_STATE_CACHE_PATH": "$GAMEDIR",
                        "STAGING_SHARED_MEMORY": 1,
                        "__GL_DXVK_OPTIMIZATIONS": 1,
                        "__GL_SHADER_DISK_CACHE": 1,
                        "__GL_SHADER_DISK_CACHE_PATH": "$GAMEDIR"
                    },
                    "exclude_processes": "Agent.exe \"Battle.net Helper.exe\""
                },
                "wine": {
                    "overrides": {
                        "nvapi": "disabled",
                        "nvapi64": "disabled"
                    }
                }
            },
            "content": "files:\n- setup:\n    filename: Battle.net-Setup.exe\n    url: https://www.battle.net/download/getInstallerForGame?os=win&gameProgram=BATTLENET_APP&version=Live\ngame:\n  arch: win64\n  args: --exec=\"launch WoW\" --exec=\"focus play\"\n  exe: drive_c/Program Files (x86)/Battle.net/Battle.net.exe\n  prefix: $GAMEDIR\ninstaller:\n- task:\n    arch: win64\n    description: Creating 64bit Wine prefix.\n    name: create_prefix\n    prefix: $GAMEDIR\n- task:\n    app: arial\n    arch: win64\n    description: Installing Arial font...\n    name: winetricks\n    prefix: $GAMEDIR\n    silent: true\n- task:\n    name: winekill\n    prefix: $GAMEDIR\n- write_json:\n    data:\n      Client:\n        GameLaunchWindowBehavior: '2'\n        GameSearch:\n          BackgroundSearch: 'true'\n        HardwareAcceleration: 'false'\n        Sound:\n          Enabled: 'false'\n        Streaming:\n          StreamingEnabled: 'false'\n    description: Writing a Battle.Net config file\n    file: $GAMEDIR/drive_c/users/$USER/Application Data/Battle.net/Battle.net.config\n- task:\n    arch: win64\n    description: 'Wine Staging: Enabling DXVA2'\n    key: backend\n    name: set_regedit\n    path: HKEY_CURRENT_USER\\Software\\Wine\\DXVA2\n    prefix: $GAMEDIR\n    value: va\n- task:\n    name: winekill\n    prefix: $GAMEDIR\n- task:\n    arch: win64\n    description: 'Installing Blizzard App. An installer will open.\n\n      ------------------------------\n\n      After the App installs a login window will open.  Do Not sign in here. Close\n      the window and allow the installer to finish.  You can login and install the\n      game once the installer script completes.'\n    exclude_processes: Battle.net.exe Agent.exe \"Battle.net Helper.exe\" wineconsole\n      explorer.exe conhost.exe svchost.exe\n    executable: setup\n    name: wineexec\n- task:\n    name: winekill\n    prefix: $GAMEDIR\nsystem:\n  env:\n    DXVK_CONFIG_FILE: $GAMEDIR/dxvk.conf\n    DXVK_HUD: compiler\n    DXVK_STATE_CACHE_PATH: $GAMEDIR\n    STAGING_SHARED_MEMORY: 1\n    __GL_DXVK_OPTIMIZATIONS: 1\n    __GL_SHADER_DISK_CACHE: 1\n    __GL_SHADER_DISK_CACHE_PATH: $GAMEDIR\n  exclude_processes: Agent.exe \"Battle.net Helper.exe\"\nwine:\n  overrides:\n    nvapi: disabled\n    nvapi64: disabled\n",
            "discord_id": "356875762940379136"
        }
    ]
}